subreddit,title
WritingPrompts," It's been over 800 days since you landed on Planet Omega-Phi in search of potential life. Every day your rover's scanner have picked up no signs of life even to the tiniest cell. Then on day 823, the scanners start going off. They've picked something up"
WritingPrompts, Humans are the only species known to have domesticated animals. Other races are abducting humans to show them how to do it.
WritingPrompts," He has been blind all his life. Now, he is the first recipient of new technology that will grant him sight. When he opens his eyes, the doctors ask if he can see them. He says “Yes, but who are they?” and points across the room at no one."
WritingPrompts, You’re dying...and dying. And then you die. But you wake up. You’re now an animal. You’ve started to enjoy this second life.
WritingPrompts," Humanity has found a way to circumvent the need for sleep, allowing increased time for productivity and leisure. Unfortunately, you are a bed and matress seller."
WritingPrompts," You wake up in the afterlife along with a group of people. None of you remember your pasts, or how you died, but as you price together clues, a horrible secret reveals itself."
WritingPrompts,"It was a long fall. He had plenty of time along the way to figure out where, exactly, it all went wrong."
WritingPrompts," The city's hero and villain share a secret that they'll never tell a soul, they're actually both super powered actors, they're actually best friends, and their daily bouts of good and evil are just them putting on a show to keep the denizens of the city excited in the face of the day to day."
WritingPrompts,"[EU] With the popularity of the pro-science Jurassic World, a Gospel group decides to make their own creationist-themed dinosaur zoo."
WritingPrompts," You’re a car mechanic, and you and your fellow employees have been spending the last year modifying your personal vehicles to war machines. When you’re all done, you each exit the garage, engines revving."
WritingPrompts," A man always stops and stands at the street corner near your office at the exact same time every day. After months of this, as you boredly watch the man standing, something happens..."
WritingPrompts," Long lives and time travel are well established, society has evolved to the point where kids are raised by their future selfs. Orphans are scorn and pitied as they either die young, or grow into someone who wouldnt even come back. It's your 14th birthday and you meet yourself for the first time"
WritingPrompts," Cinderella always dreamed of the life of freedom, to do things that you want without being forced to servitude. Until one day, god mother came and told her to do so, she needs to marry the prince and be a princess. Promptly replied ""But I don't want to be a princess.. I want to be a witch"""
WritingPrompts,"[EU] Everything seems to fall apart once the getting gets good. Everything you hold seems to break and those you love seem to disappear. You walk the streets in your lonesome when a man with a large bag appears before you holding a mask and says “You’ve met with a terrible fate, haven’t you.”"
WritingPrompts," You pick up a hitchhiker on the side of the road. He seems a little strange in the little conversation you have, mentioning things like ""back home"" and ""you people"". When you drop him off, however he slips you a book - Hitchhiker's Guide to the Galaxy."
WritingPrompts,"[IP] Scientists have long pondered the mystery of the Sailing Stones. A few years ago, it seemed as if a plausible answer was found. It was wrong. We know it was wrong, because today, the mystery was solved for real. And we are terrified."
WritingPrompts," In the future, as the release of Google's fully immersive VR nears, the company declares independence and sovereignty over its users."
WritingPrompts," A kids Space Camp decides to use ""Now enrolling students from anywhere in the Galaxy!"" as their cute tag line. To their surprise someone took this literally"
WritingPrompts," You live in a world in which the name of a person at birth determines something about them. Common names include ""Happy"", ""Lucky"", ""Smart"", or even names like ""GoodWriter"". You, on the other hand, are named ""Jordan""."
WritingPrompts," Slowly the laughter around the table fades as everyone begins hearing it, and one by one their heads turn to the door, which someone is knocking on. Trouble is, they are in the middle of nowhere, and the nearest road is a two day walk away."
WritingPrompts," earth is inhabitable for humans, every other animal and plant can survive on the planet easily, few humans are frozen ready to reawaken in millions of years when earth becomes habitable for us again. After coming out though we find that dogs have evolved to an intelligence comparable to ours."
WritingPrompts," You drop off a strange hitchhiker. As you begin to drive away, you glace in your rear view mirror and spot the man crawling at inhuman speed close to the ground right at your car."
WritingPrompts," They say “you either die a hero, or live long enough to see yourself become the villain”. At 900 years old, you’re really beginning to wonder how long until you can be evil"
WritingPrompts," The air froze so hateful it burnt, and the sky looked like God had shone a light onto the earth looking for the unredeemable."
WritingPrompts," A young woman escapes from a cult that she'd been born into. As she runs from the cult, she crashes into somebody. She tried to profusely apologize, but she realized that she had crashed into someone who was tried as a Heathen by the cult."
WritingPrompts," You and a couple of friends decide to bid on an abandoned, locked storage unit and win. You go there and break the lock, but the doors won't open. As a joke, one of your buddies says, ""Mellon"" and the frame begins to glow."
WritingPrompts," A genie you encounter grants you 3 wishes. In an attempt to outsmart the genie you ask for infinite wishes. To your surprise your wish is granted, but after wish #1137 you start to realize what your initial wish implies, any wish you make must always be followed by another wish. Always. Forever"
WritingPrompts," After 20 years of living in your safety bunker, food has run out, forcing you to leave for the first time. To your astounding surprise, the Y2K apocalypse never happened and the world has been doing fine all along."
WritingPrompts," Every Christmas, Satan actually brings Presents to all the children who misspell Santas name as a guilty pleasure. But one faithful Christmas, he collides with the real thing, Kriss Kringel himself."
WritingPrompts, You've been reincarnated as the voice in somebody else's head
WritingPrompts," A Peaceful Bard is well loved by his village. One day when bandits attack he puts his lute away, cracks his knuckles, and proves peaceful doesn’t mean pacifist."
WritingPrompts,A young boy who goes missing for 10 years returns from outer space to reveal that the world is going to end in 10 months.
WritingPrompts," The World really did End on Dec 21, 2012. But humanity doesn't know, because we've been living in a simulation since then."
WritingPrompts,"[EU] You're just a regular worker at a theme park. You call machomei when you need security, when it's pikachus' break there are power outages, kangamas are stressed about lost&found children... just another day at Pokeworld."
WritingPrompts,"[IP] Class 231B, Designation: Other"
WritingPrompts,[OT] The Invisible Prompts
WritingPrompts," Just like vampire bites turn humans into vampires, human bites turn vampires into humans. The protagonist(s) discovers this in middle of a vampire attack."
WritingPrompts,"[SP] ""Meow meow meow, meow."" ""That... is the worst plan I have ever heard of."" ""Meow meow!!"""
WritingPrompts," In a future world where everything is electronic (but on segregated networks because privacy laws), you are the world's greatest phone call tech support. However you are retiring and your frustrated and incompetent colleagues have no idea how to prevent the oncoming apocalypse."
WritingPrompts," You have reached the staring contest finals. Eyes locked for hours, your opponent's determination is starting to waver. For you, it's actually becoming easier. Are you seriously falling in love right now?!"
WritingPrompts, For generations all music has been produced by AI. A young person discovers an ancient piano while exploring some ruins.
WritingPrompts," Humans are the weakest sentient species in the galaxy. Their skin is torn at the slightest pressure, their bones break from a small fall. But as a superplague sweeps the galaxy, it quickly becomes clear that their doctors have a LOT of experience."
WritingPrompts," in the future soulmates are a proven but rare phenomenon. Not to worry... technology can easily match you with soulmate, but only once it matches and guides you to your 100% soul enemy."
WritingPrompts," You're an intelligent dinosaur who knows a meteor is going to come and destroy the planet. However, the elder more religious dinosaurs don't believe you. They convince the rest that you are crazy. But you know you're right and the fate of the planet is in your hands."
WritingPrompts," ""We have given you many warnings and looked the other way even more. The Council cannot sit on its hands any longer as an unruly God does its bidding. Return to the mortal realm, and think of your acts."""
WritingPrompts," Start the story with a ""walks into the bar"" joke, but turn it into an actual story."
WritingPrompts," Love has become a marketable emotion. Well, even more so now that the emotion itself can be formed into a corporeal form. A stone. This brought a new trend, and new industry has come to provide for said trend. ""Give your loved one a stone to show your love, like a penguin."""
WritingPrompts, You work at the Human Resource department in Willy Wonka's factory. You are instructed to announce a major retrenchment of 60% of Oompa Loompas due to automation.
WritingPrompts," Destroying the spirit king was easy, compared to your next task: preventing the spirit world from falling into anarchy by establishing a stable form of control."
WritingPrompts, In a world where animals that are dangerous suddenly become docile while cute/innocent animals become aggressive apex predators you have one obstacle left to reach salvation. A petting zoo.
WritingPrompts," Morality is gone. Gene splicing has run amok. The NBA and NFL has finally managed to have human genes spliced with blue whales, monkeys, cheetahs, etc."
WritingPrompts,"vampires are at war with humans and then, with humans in the brink of defeat, aliens start thwir invasion and think that vampires are just weird humans"
WritingPrompts," When a cryogenics experiment goes wrong, you're frozen for 1,000 years. Humanity has forgotten its past and the new civilization worships familiar items as holy relics. Flipping through some holy ""texts,"" you recognize the symbols for one of their gods - it's your reddit user name."
WritingPrompts," From recent studies, in time all stars will run out of heat and just be floating rocks in an empty void. You are the leader of a colony going from white dwarf to white dwarf to keep your space colony afloat with light."
WritingPrompts, As long as you explain to someone how to do something in video game like terms then that person would be able to do it no matter how complex or impossible the task is.
WritingPrompts, Evolution used to take millions of years but scientists have noticed wildlife starting to adapt drastically to human expansion with potentially apocalyptic consequences.
WritingPrompts," After the dissolving of the Avengers, Bruce Banner decides to educate the youth and becomes a teacher at a high school. Tension starts however, when his delinquent class really don’t care about making him angry and start problems."
WritingPrompts, Every day a new villain challenges you but your powers shift every morning to perfectly combat the threat. This morning you wake up to find that you have no powers.
WritingPrompts," Lately you've been noticing that when you catch your reflection in the mirror, something is not quite right -- the motion is just a bit off, the look not exact. One morning while getting ready in your bathroom, your reflection slips you a note."
WritingPrompts, The Phantom of the Opera works very hard to prevent disasters during a theater production. Shenanigans ensue.
WritingPrompts," You may not have a time machine, but you can always retcon your life by lying to your diary."
WritingPrompts," You wake up and crawl out of a cold glass tube into a dim and windowless room with metal walls and blinking lights. You are alone, except for a strange machine you know as Sister Unit."
WritingPrompts, You are an evil sorcerer that was killed by a knight in medieval times. You are finally reborn so that you can take your revenge. The year is 2019 and you have been reborn into a middle class family living in Las Vegas.
WritingPrompts, you are a supervillain he'll bent on wiping out humanity but your only power is to heal people instantly with a touch even from death.
WritingPrompts,[PI] You remembered being murdered but it seems as though nobody else does and somehow you’re still alive. One day you see the person that supposedly “killed you” so like any reasonable human you follow that guy. What you see truly horrifies you.
WritingPrompts," You're a prison warden: your job has become more and more quiet in the last months. The prisoners have found a new messiah among their number. They've begun meditating. The day of 'his' execution, he doesn't die."
WritingPrompts,"[EU] As a master modern day dream hopper, you go to other people's dreams. You suddenly find yourself in a dream as a result of SCP 1230."
WritingPrompts," Magic and mythical creatures are real. However, the magic that encompasses all things will not allow non magic beings to remember events related to magic. After a freak pixie encounter at a restaurant you remember it all and cant seem to understand wtf is going on."
WritingPrompts," 120 years after a global nuclear war, your tribe in what was once known as New Jersey starts seeing “metal birds in the sky”, and large objects floating in the distance far out at sea."
WritingPrompts," You're suddenly part of a game of death after a mysterious 'distributor' gave you a piece. ""Only 32 people in the whole world has a piece,"" he said, ""and yours happens to be the black king."""
WritingPrompts," You discover what you theorize to be a planet attracted to wormholes, knowing this, you demand your team of astrophysicists send a trackable camera on the planet. The next morning, the planet is suddenly trillions of light years farther. The camera you sent is still in perfect condition."
WritingPrompts," A young couple shoves popcorn in their mouths, watches their favorite slasher film in suspense, and appears oblivious to the real masked killer standing right behind the couch. The masked killer, with knife in hand, notices what the young couple is watching, and becomes frozen with suspicion."
WritingPrompts," Being sick of all the people around you testing if there’s somehow a mind reader randomly looking into strangers heads, you go and set up the first ever psychics anonymous."
WritingPrompts," While taking a bath, you dunk your head under the water and hear a cry for help."
WritingPrompts,You have always had an uncanny ability to know with absolute confidence and total accuracy if people are telling the truth or lying. Then one day you are summoned for jury duty.
WritingPrompts," The Martians from the original 1898 book attack humanity in the 2030s, in an era where we have embraced the use of robotic troops, drone air fleets, cybernetic soldiers and elevtronic weaponry."
WritingPrompts, You are trying to find your family weeks after a Zombie apocalypse broke out to see if they have survived. The only problem is that you are in fact a zombie and see humans as monsterish creatures. You are unaware of your state.
WritingPrompts," In order to prevent the population crisis from worsening and to help endangered species, God decided to transform half of humanity into non-human animals. The animals that people become are based on one's personality."
WritingPrompts, The Golden Girls but they are the charmed ones.
WritingPrompts, It's hard working as a low tier ambassador for an alien empire. And the weird temporary alien body you're stuck in sure isn't helping.
WritingPrompts,[IP]Eccentric store
WritingPrompts, Historians found another diary written by George Washington! But this one is a little strange. It recalls the time he went into the future to see how the United States turned out in the far off year of 2019.
WritingPrompts," Blackbox retrieval was the safest, if grimmest, job in the outer solar system. Usually."
WritingPrompts," Your friend is fast, but you are faster. Fleet feet versus fast flight. In race to see who is the fastest, you rip through time and space. This world you’ve crashed into looks similar, but ever so changed. You smell decay, death. You hear a groan."
WritingPrompts," You chose to be frozen rather than die from an incurable cancer. Now you have been woken up, cured, in the distant future...except it isn't humans that have woken you, since they are extinct."
WritingPrompts," You have a habit of saving moths drowning in puddles. One night, you get attacked and help comes in an unexpected form."
WritingPrompts, You work in the typical corporation in cubicle. Six years ago your boss jokingly put a “No accident days” counter. Today you noticed that the counter displays “0” for the first time and everybody stares at you when you enter the office.
WritingPrompts," It's a world in which fate is sealed from the moment of birth. Everyone is born with a digital clock over their heads, showing the amount of time until they will die. The countdowns are only visible by other people, and telling someone how much time they have until death is strictly verboten."
WritingPrompts,"[SP] Every writing prompt ever created on the subreddit r/WritingPrompts comes true. You are one of the few people why the world changed, the reason being your a writing prompt submitter."
WritingPrompts," The year is 2125, and the world is in shambles. Another planet outside your solar system is confirmed to support life and is the last vessel of hope for humanity. You are the captain of the ship who led the journey. You arrive to realize you ended up in the wrong solar system."
WritingPrompts,"[EU] What started out as genuine curiosity, spiraled into a walk into the dark arts. But along the way, you told yourself not to lose your light. In the end, after months of planning, second guessing, and constant convincing yourself to go through with it, you've successfully created a Horcrux."
WritingPrompts," A few dangerous, test models disappeared from the replicant lab and the company is looking for them. The easiest way of identifying them is to ask: When someone tells you a ""man walks into a bar"" joke, do you always imagine the same bar? If so what does it look like?"
WritingPrompts, Your mother was right. You should have stayed away from that boy with the funny hat. But you're 16. You can make your own decisions for yourself. But now you're in a strange place with giant chairs and massive flowers and strange smells and all you can think about is getting home alive.
WritingPrompts," Taking a note from Australia, a countries of the world have begun shipping off their criminals to a newly discovered planet. Unfortunately, nobody asked the locals' opinion, and they're not happy."
WritingPrompts," One of your parents is a superhero, the other is a villain. You found out both of their secret identities years ago, but neither of them knows the truth about the other."
WritingPrompts,"[EU] With the rise of cellphones, phonebooths have disappeared, and now security cameras are nearly everywhere, too. Clark Kent is finding it more and more difficult to transform into Superman without being seen."
WritingPrompts," In an attempt to save humanity from an endangered Earth, we have hatched a plan to ignite Jupiter and terraform one of its moons. The ship carrying the fusion device is set to launch."
WritingPrompts," You are the world's greatest assassin. One catch, your assassination skills only work when you're wound up like a children's toy. Today is the most dangerous assignment of your life, and your handler has lost your wind up key. Now you must bumble through this assignment without those skills."
WritingPrompts, Usually people that wander into the Dimension of Lost Things are looking for material objects. You're looking for a person.
WritingPrompts, You are a soldier in the King's army. Rumours have been circulating that a Legendary Weapon has been spotted on the battlefield.
WritingPrompts,[IP] The Cat Hairdresser
WritingPrompts,"[PI] Each magic spell has a finite number of uses throughout a person’s lifetime, and the number varies from person to person. However, everyone has unlimited uses of a single spell. Your unlimited spell is one that most people can only use once in a lifetime, if at all."
WritingPrompts," You keep turning the light on and off in quick succession, until it finally stays off. You hear a gasp of air from the light saying, ""Just wait a minute! I need to catch my breath!"""
WritingPrompts,"[EU] In the realm of JoJo, a middle aged man named Dave works in a dead end accounting job with his stand, a pen that has the ability to change colours. Dave has decided that he wants to use his pen for Justice and is now roaming the streets looking for villains."
WritingPrompts," ""Greetings Earthlings!"" the friendly alien said across all media, ""I can adjust anything about your planet. Atmosphere gases, gravity, even your day/night cycle. I only need a few small things in return."""
WritingPrompts, The forces of hell have finally conquered heaven. You are the top analyst for the best management consulting firm in the world. Satan just hired your company to do the merger and acquisitions to smooth out the transition.
WritingPrompts,The gods used to be rather provincial and satisfied with ruling their own corners of the world. Things were going pretty well until Jehovah showed up.
WritingPrompts, In 2020 the first blue skinned baby was born. Tests could not find the reason for the blue skin. Genetically and behaviourally it is normal. It’s now 2030 and one in 5000 births globally is blue.
WritingPrompts," Everybody's heard about the legendary feats of Chuck Norris, but you are a legend in the making and you just shed a tear."
WritingPrompts," Scientists have found the answer to the Fermi Paradox. As it turns out, our Universe is an incubation ground for species that haven’t discovered interdimensional travel, and we find a larger, more densely packed reality once we leave."
WritingPrompts," You die. Instead of going to the afterlife, you are presented with 2 choices: Retry, or Character Select."
WritingPrompts," Write an SCP file for a human, written by an alien race that has never seen them before."
WritingPrompts,[SP] You find headphones that allow you to hear the past!
WritingPrompts," You and your family have spent years ignoring that one crazy relative at family gatherings. Today, you wake up... and suddenly, they were right."
WritingPrompts," After a severe head injury as a child, you grew up without the ability to speak. One day, whilst waiting in line at the supermarket, you crack a particularly excellent joke in your head, and the person behind you in line can’t stop laughing."
WritingPrompts, Whatever helps you wake at day.
WritingPrompts, A fantasy battle between Demons and Humans. The Demons try to defend their city while the Humans pillage the surroundings. Three turnarounds occur.
WritingPrompts, you crush who is in the year above you at school has vanished without a trace and no one is willing to look for them. One day you are walking through and pass by their locker and a clue as to where they might have gone falls out
WritingPrompts," You are driving on the highway and all the sudden get run over by a semi truck, you wake up in your office at work, you browse on your computer and see a news article about a highway crash, the body was “unidentified”"
WritingPrompts," You're working in a government building and one of the elevators has always been left without use because it apparently is a 'trap elevator' with 'mind of its own'. Today, distracted by some urgent deadlines to meet (and life), you accidentally step into the trap elevator"
WritingPrompts," Prisoners are locked up in virtual reality prisons representing a ""perfect world"" they would never want to escape from. Due to a glitch, you are locked up in the world perfect for your 12 year old self."
WritingPrompts,"[OT] Rather than the Gods of strength or intelligence, your father prayed to the Lady of Luck—now a short story!"
WritingPrompts," As the coronation drags on, members of the coup begin to tremble not knowing why. For within the dungeons, the true Empress cries for aid; with this, the Empire's finest begin rise out of their graves, break free from demonic chains, and force themselves back into the mortal plane."
WritingPrompts," In 1979, a devourer of worlds approached the Earth... lucky for the humanity, the alien met Joe Girard, the best car salesman in the world."
WritingPrompts," You had always heard that cats can “sense” when someone is about to die. You’ve always been skeptical, until your most recent trip to the hospital. Wandering the halls of your ward, you see a pitch black cat, followed by a floating scythe."
WritingPrompts," You have the ability to understand and speak any language fluently, but you can only do so when you feel acutely embarrassed or ashamed."
