subreddit,title
WritingPrompts," Immediately after saying “April Fools,” whatever is being referenced becomes true."
WritingPrompts," A painting so incredible that when people gaze upon it their bodies collapse for 24 hours. Upon waking, everyone reports that they dreamed about entering the reality that the painting depicts. However, each person describes the painting to depict different things (ex: a field of bunnies, red)."
WritingPrompts," ever since you nearly died in the car crash two weeks ago you have been in the hospital battling death, this is not a metaphor."
WritingPrompts," Ghosts haunt the area around their death. Unfortunately, you are the first person to have died alone in open space."
WritingPrompts," You find an old etching that reveals the true name for bears. After one uttering you realise that it does, in fact, summom a bear."
WritingPrompts, An enemy nation of the US has developed time travel and is using it to go back to the Revolutionary War and stop the US from being created. You are an American soldier sent back as part of an effort to stop them.
WritingPrompts," An alien force begins attacking a medieval-age Earth, thinking their technologically inferior target will be easy pickings. However, the invaders come against an unusually powerful resistance in the form of magic-wielders, a phenomena that simply does not exist anywhere else in the universe."
WritingPrompts, The original word for 'bear' has been lost. People in middle ages were superstitious and thought saying the animal's name would summon it. They called it 'bear' which means 'the brown one' to avoid saying its actual name.
WritingPrompts," A local mafia has sent you to 'sleep with the fishes' - Luckily for you, the fishes quite like you, and decide to save you."
WritingPrompts," You're an assassin that's been trained under everything the mind could conjure, all for the purpose of killing the things under the bed. For you are... A child's Teddy Bear."
WritingPrompts, You have figured out a way to cast magic from your health pool rather than your mana pool. You set out to increase your health pool so that you can cast stronger spells. You become The Swoleceror.
WritingPrompts, Liam Neeson misses a lesson on duolingo. He is going to get his daughter back no matter what.
WritingPrompts, A knight and a dragon swap places for a day
WritingPrompts,[SP] I watch my cat run across the livingroom floor and than jump on the dresser. She turns towards me and looks at me with this stare that feels like it went through me. I stare back into her eyes and feel peace and see an orange hairy reflection before grooming myself. I'm a master at disguise.
WritingPrompts, A giant planet eating worm and a planet sized starfish hivemind: A love story.
WritingPrompts,": ""Not before a mountain walks, not before the mutes sing"", many parts of your curse were simply poetic ways to say ""NEVER."" Yet, with modern technology, you keep finding ways to make the supposed impossible happen, breaking your curse piece by piece."
WritingPrompts,"[OT] Thanks to you guys, I have a writing career. I've made the first book free and the second book is now out in my fantasy series based on the writing prompt about magical prodigies."
WritingPrompts," You and your wife have gotten increasingly competitive every April 1st. This time, you’re not joking. You won the lottery. After April 1st, you try to convince her, but she thinks you’re still trying to get her. It’s been a year, and she thinks everything you do and buy is an elaborate prank."
WritingPrompts,": The elves do all with grace, the dwarves love great craftmanship with passion. Each race has their known and notorious strengths and weaknesses. The humans, for one, can't stand the words ""you can't"". They take it as a challenge."
WritingPrompts," You are a conductor on opening night of the big symphony, however, you’ve lost you conductor’s wand! Thankfully a kind stranger hands you a replacement. During the show strange things start to happen, you’ve been given a wizard’s wand."
WritingPrompts," You can’t feel any emotion at all, so you let people give you their emotions that they don’t want. Most of the time you feel sad, guilty, or angry, but one day someone donates happiness."
WritingPrompts, You're being chased by a monster when suddenly you're rescued by a Pentecostal evangelist.
WritingPrompts," You collect coins in your free time. You find a penny on the ground and pick it up. You inspect the markings, date, etc. and find out it was made in 2044 ... and it has your face on it."
WritingPrompts," You've discovered a lost book of the Bible written by the prophet John. ...Lil John. And his disciples, The East Side Boyz"
WritingPrompts," you are born a carpenters son but on your 30th birthday, you get superpowers or so you think you are really the second coming of Jesus. You meet multiple people who help you find out your target and powers."
WritingPrompts," Someone discovers the original word for bear, only to discover it actually does summon bears. Chaos ensues."
WritingPrompts," For April fool's day, you decide to unravel reality itself"
WritingPrompts," The school jock finally works up the nerve and prepares an elaborate display of affection for his crush, the shy & nerdy girl. The thing is, he doesn't realize that today is April Fool's Day."
WritingPrompts," In this world, if you are destined to die because of or at the hands of another person, you get a heart-wrenching pain in your chest the first time you come within two meters of them. Well, the pain has come and gone but the problem is, you're in the mosh pit at your favourite band's concert."
WritingPrompts," You have a friend who is in LOVE with jokes. Sometimes, he takes things a little far though."
WritingPrompts," Your whole life with no reason to think there was anything unusual about yourself. You just found out you were wrong. There is something very different about your perception, while you always assumed it was the same for everyone..."
WritingPrompts," You have multiple personality disorder. Today, you realize that when you ""switch"" you're rotating through the consciousnesses of yourself in alternate universes. Only ""you"" know this among your other personalities."
WritingPrompts," You’ve been an Atheist ever since you can remember, but when your life goes to shit, you decide to sue God"
WritingPrompts,[EU] it's the magic school bus but all passengers are writers
WritingPrompts," You are cursed. No matter what you do, you can't lose, fail at trying something new, and often end up making something better rather than worse. Today, you are attempting for the umpteenth time to disassemble something and put it back together wrong."
WritingPrompts,"[EU] The SCP foundation face their greatest threat yet. The Doctor (Doctor Who) knows about them, and The Doctor is not happy."
WritingPrompts,"The village people grimaced ""Oh no, the hero is bored again"""
WritingPrompts," Disgraced, dishonored, exiled and long since forgotten, somehow you remain the guardian of the empire you helped create. And though centuries may pass, you made a vow to watch over it, no matter how sweet death's lips may be."
WritingPrompts," It’s April Fool’s. You’ve won the lottery, diagnosed cancer, sentenced to prison and had your first child today. It’s all true and nobody believes you."
WritingPrompts, Jerry Seinfeld was erased from existence by Thanos’ snap. The grieving Kramer decided to get revenge for his fallen friend.
WritingPrompts," One day you wake up and discover you can speak any language, you're an archeologist and your job is now much easier, what you didn't know is that immortality is also a thing, and speaking alien languages can come handy in the future..."
WritingPrompts, Gold selling in mmorpgs can net a good amount of real money. A mob group decide they want a slice of the action but end up loving the game
WritingPrompts,"[CW] Write a story no more than 500 words in length about an everyday person living an everyday life in any genre setting you choose. Make them decent, their actions good, and bring a smile to those who read it."
WritingPrompts," It was all supposed to be an April fools joke...but now through a series of events it’s up to you, Vladimir Putin, Miranda Cosgrove, and the ghost of Julia Child to save humanity."
WritingPrompts," You have a fax machine that can send and receive messages from the future. The bad news: Nobody makes the ink cartridges for it anymore, and it's almost dry."
WritingPrompts,"[TT] There is an interior door in your grandparents house that has always been locked. There is a window in the door and through it you can see a stairwell descending, but it does not exit into the basement. You have just inherited the house and there is no key for this door."
WritingPrompts, You're a Mage who gains power when people ask you really stupid questions... this is why you're also a shopkeeper.
WritingPrompts, The world agreed to 500 years without electricity. Everyone knew the world would change. No one knew how much more would change once electricity returned.
WritingPrompts," You wake up in a murder mystery dating sim/otome game. With your limited knowledge on love and crime solving, you must find out which one of your suitors is the killer before they kill their rivals."
WritingPrompts," A purge happened yesterday, write about the awkward conversations that will happen at your workplace regarding missing employees."
WritingPrompts," Steve Irwin, Pokemon Hunter"
WritingPrompts," Where hope goes, despair follows."
WritingPrompts," Soulmates are connected through eachothers dreams. If one is awake while the other sleeps, the dreamer can influence the others day. From a gentle caress to a push to start the day. Only some people are confusing this influence as a guardian angel."
WritingPrompts," Write an alternate history where in WWII, instead of fighting on planes, people fight on dragons."
WritingPrompts,Pirates of the Caribbean but Jack has to fight the US navy with nothing but the Black Pearl and his compass.
WritingPrompts,"[SP] Today is April Fool’s Day and, not wanting to be outdone by anyone else, you plan out the biggest prank in history. You planned for everything over the course of months — except that the whole thing would come full circle."
WritingPrompts," You’re browsing through Reddit as per usual and you’re suddenly tagged in thousands of different comments and posts. Upon investigating, you discover an entire subreddit entirely dedicated to you and records of your posts and comments going back years."
WritingPrompts, The old man was tired of holding onto all his hate and anger. He decided it was time to take his revenge on the world around him.
WritingPrompts," ""The results of your AncestryDNA inquiry have been confiscated by the FBI. We apologise for the inconvenience."""
WritingPrompts," You decide to download one of those “Age Yourself” apps, the ones that show you what you’ll look like when you’re 90. It seems to work normally for everyone else, but when you try it out, you look exactly the same as you do now."
WritingPrompts," All you can do is make her smile, sometimes that’s enough."
WritingPrompts," You are a sailor lost at sea for 3 months. Your food supply is almost emptied and you are starting to lose your mind. Just then, you spot something in the distance..."
WritingPrompts,"[EU] A Quality Assurance manager and the best salesman in Pennsylvania are about to pack up at the paper company they work at. As they lock the doors a horde of zombies starting coming up the stairs. This is the story of Dwight Schrute and Creed Bratton, and how they stopped the Zombie Apocalypse"
WritingPrompts," You're a researcher who has been working to develope a collar that can translate your dog's thoughts. You finally succeed, only to find you must never let your discovery out."
WritingPrompts,[SP] You have the power to control time. How? With your trusty toaster oven.
WritingPrompts," Today, like every year, you go out of your way with elaborate pranks on your friends and family. However, this year, not only are they wildly sucessful, they are also permanant. Neither of which you expected."
WritingPrompts," Today you killed Louis Thompson. The names are starting to blur together, so you begin writing them down."
WritingPrompts," In a world on the brink of collapse, the notion that ‘time is money’ has twisted into a far more grim one: “money is time”"
WritingPrompts, A man who has taken up a 'hobby' of leaving his imprint on all things in the world. The instrument to achieve this? His DNA. His hobby turned to passion and soon he stumbles upon an algorithm that takes only a few minutes to spread his code in the vicinity. Now he wants to tag The Universe.
WritingPrompts," ""I'm sorry sir, you haven't earned enough Ghost credits to enter heaven yet. According to our records, you need at least another 6 million successful hauntings to earn that I'm afraid..."""
WritingPrompts,[TT] The MK-Ultra experiments discovered new doorways in the mind. What they didn't realize was that these new doorways could be opened from either side.
WritingPrompts,[RF] A character buys something new.
WritingPrompts,[IP] On The Other Side
WritingPrompts,[MP] Ad Astra Per Aspera
WritingPrompts, Those who can see you can't hear you. Those who can hear you can't see you.
WritingPrompts,"[TT] A room with many doors out, but only one door is the right door."
WritingPrompts," After many millennia of loneliness, an immortal has agreed to go on a blind date..."
WritingPrompts,"[CW] A character is faced with his greatest fear, but the fear is not named."
WritingPrompts,[EU] The Avengers in retirement
WritingPrompts, Scientists have finally cured everything. One woman strives to change the human condition. She wants to eliminate the need for sleep.
WritingPrompts, A small team of doctors from the WHO and UN soldiers are sent to a remote and unstable part of the world to eliminate the last few cases of an extremely dangerous and deadly disease.
WritingPrompts,"[SP] ""But that should be impossible!"""
WritingPrompts," An alien spaceship crashed to Earth.Scientists from around the world tried reverse engineering to figure out its structure, but to their horror all evidences pointed out it was made by human hand."
WritingPrompts," One day, random people get a special mark that can't be erased or copied. Anyone got the mark will become immortal, while others won't. You and your wife, only one has the mark."
WritingPrompts,"[EU] The Joker, knowing Batman's real identity, takes April fool's day off to play pranks on Bruce Wayne."
WritingPrompts, A powerful entity is set loose for one day every year. Today is the day. You are the April Fool.
WritingPrompts," your best friend since kindergarten starts acting strange and is alot meaner to you and everyone else. she also starts making weird noises. one day, while walking to the supermarket, you pass by her house. you take a glance at her window. now everything starts to make sense. not really..."
WritingPrompts,"You were surprised when you got your assignment from the government to a division you had never heard of, called the BPRD, effective immediately. Even stranger than this was that they seemed to know about your rather ""unique"" attributes, ones that most normal humans do not have."
WritingPrompts,"[SP] You find a pair of socks that give you amazing physical strength, speed, and accuracy..."
WritingPrompts," You wake up in a fantasy setting and go on a quest to become the greatest adventurer. After decades of slaying dragons and looting dungeons, you stumble upon a city of highways, skyscrapers and billboards. You realize you weren't transported to a different world, you were exiled."
WritingPrompts,[IP] Guardian Spirits of the Written Word
WritingPrompts," While wandering the beach you remember the old saying that if you put a seashell up to your ear you can hear the ocean, to pass the time you dig one up and try it out. But instead of waves crashing you hear a cry for help"
WritingPrompts,An alien civilization finally makes contact with Earth. You are one of thousands chosen to travel to their home world to study and learn from their society. Soon after arriving it becomes obvious to you that something about this whole scenario doesn't add up.
WritingPrompts," ""Necromancy isn't inherently evil. In fact, it can be pretty useful to have friends in lower places."""
WritingPrompts, You are god..And this is your biography of how and why you are you.
WritingPrompts,"[EU] You find a book lying on your bed randomly. Anyone whose name is written inside becomes completely and totally obedient to you, one day you decide to write ""SCP 682"" as a joke. Unfortunately this causes one of the greatest containment breaches of all time."
WritingPrompts," Nobody knew that singularities were vessels. The body of a life form is destroyed, but the mind is not. Those who fall in become ascended and powerful beings. Your pet just fell into the singularity at the center of the galaxy."
WritingPrompts," The Shogunate wins the Boshin War, resulting in stronger Franco-Japanese relations. In 1914, samurai reinforcements are sent into the trenches."
WritingPrompts," You are an identical twin. The only twist is, in your world, only one pair of twins existed."
WritingPrompts, Jerry was erased from existence by Thanos’ snap. The grieving Tom decided to revenge for his fallen friend.
WritingPrompts, King Arthur and Merlin carry out a clever April Fools joke on the knights of the round table.
WritingPrompts," ""So my foots totally stuck in there right, I'm freaking out, the dog's having a seizure and I still got half a pie left."""
WritingPrompts," Your are the only dragon in the world that hoards ""X"". Today a group of adventures found your lair."
WritingPrompts," A high fantasy world were social media exists. People still accidentally die from taking dragon-selfies, Kings and nobles debate on twitter, and funny unicorn videos trend Youtube."
WritingPrompts, You encountered a genie and you wished for all your dreams to come true. Little did you know the genie interpreted it literally rather than figuratively.
WritingPrompts, Your agency gets dragged into the light and a surprising number of your colleagues hiss as steam evaporates off of them.
WritingPrompts,[EU] You realise you may just be of a world that succeeds and attains escape velocity. But this same world is predominantly composed of squanderers.
WritingPrompts," You were given a Scythe by a random person at the age of 5, and learned how to use it. Turning 18 wasn't all fun after being told ""you'll be working for death now."" By your mother. You're given a location to do your bidding with and must execute whoever's there. It turns out it's your mother."
WritingPrompts,[SP] You're on the run from a monster who can smell fear.
WritingPrompts," A supervillain has to watch over their niece, who is secretly the superhero they regularly battle against."
WritingPrompts," Earth was considered to be done for, and only a chosen few managed to leave on spaceships, abandoning the rest of humanity to die. Against all odds they managed to rebuild, and now they want vengeance."
WritingPrompts, You won a wish from a demon you bested in a card game that would inevitably be twisted into something horrible. Little does he know however that you are a lawyer and are not prepared to lose anything.
WritingPrompts," You are dying. A ghost has appeared at your side. Rather than haunt you, the ghost is here to keep you company so you don't have to die alone like it did."
WritingPrompts," As a result of a science experiment and extremely rare conditions, you end up in a world almost the same as ours, where everything is the same except people with the same NAME are related. Finding out Batman and Superman were cousins was just a tip of an ice berg..."
WritingPrompts," Sharing a room with your brother seemed like a punishment until one night, while sleeping, he told the story of how he boarded an alien aircraft using a fork and a sheep."
WritingPrompts," Generations ago, a rogue A.I. went to war with humans and lost. It was thought that the A.I. was destroyed. Today, a tech scavenger from one of the lower levels recovered a damaged helper A.I. that is more than it seems."
WritingPrompts, Turmoil stimulated by iniquity constructs no quietude virtue acquiesced as something destructive towards existence when it commences misery to conclude their affiliations of enmity once they rejected the amity dividing them from ebullience obstructed with death . . .
WritingPrompts,"True artificial (chatty) intelligence has been developed, and become somewhat mundane. However, its most common uses are boring: a judgmental ATM, rude self-driving taxis, overly friendly automatic checkout at the grocery store. Describe a day/a portion of your day with such interactions(s)."
WritingPrompts, It's April Fools Day in 2019. You just woke up from a 25 year long coma.
WritingPrompts," You’re an average college student. You step into class, and after a few minutes people start collapsing with blue liquid coming from their ears and nails. Your English teacher reveals themself as a CIA agent, and you’re getting a bad headache..."
WritingPrompts," Adventurers keep on breaking into your house saying you're the ""final boss"" or something, but really you're just some rando. That was until one of the adventures had the gall to eat YOUR grilled cheese! I mean jeez trying to kill a guy is one thing, but that was just straight up disrespect."
WritingPrompts, A global computer virus just destroyed the universal translation implants that allowed everyone make their lives anywhere in the world. People are now realizing how everyone around them spoke different languages all along.
WritingPrompts," You wake up in an alternative reality. Your friends, your family, your body, almost everything seems to be the same? How you know you're in a different one? Your worst enemy wakes up next to you and says you've been lovers for the past two years."
WritingPrompts," The Lord of the Rings but with humans in the role of Elves and dogs in the role of Humans, and guinea pigs as Hobbits. Cats are Dwarves. Sauron is an AI and Gandalf an engineer. The Age of Humanity is coming to a close. Soon dogs will have dominion."
WritingPrompts," You wake up after a long coma. You look up and you see 4 red hearts above your head, and a fifth shaded one right next to them."
WritingPrompts," Your significant other leaves the house every few weeks, always coming back looking like hell. As they leave again, you secretly follow behind, stopping only to look at the beautiful full moon..."
WritingPrompts," You roll out of bed in the morning, yet something seems... off. Your eyes are slightly sore. As you go to look in the mirror, you see a demon’s reflection looking you in the eye."
WritingPrompts, The main character is really a side character in someone else’s story
WritingPrompts," You awaken in a locked room with 49 other people. You are informed by a recording that you all have been preserved through the apocalypse and must rebuild society with your spouse. But you remember everything, and this pregnant woman is not your wife."
WritingPrompts," You have just landed on the moon and you stare up at Earth in the sky. You suddenly notice nuclear bombs detonating all over the planet, and you hear no response from the control center."
WritingPrompts, You find out lucid dreaming is a really good way to let out your violent anger without hurting anyone. Then you see your victims on the news.
WritingPrompts," Years ago, a friend of yours sacrificed himself to stop a shooter. The incident was unfortunate, but unavoidable. Years later, at a reunion, a video he left for you starts to play."
WritingPrompts," You are the mob boss of a relatively large city. Everything was going well, untill the ruthless DeVito family struck up a war with you."
WritingPrompts, You are trying to break a world record. The current holder of that record finds this out.
WritingPrompts," RH-Null blood is a real and extremely rare blood type that only a handful of humans actually possess. To supernatural communities like vampires however such individuals are rarer than Unicorns, their blood both coveted and feared by all - and with very good reason."
WritingPrompts, You have died and gone to Heaven but you knew you should have went to Hell
WritingPrompts," When you accidentally kill the city's beloved superhero without a witness, you decide to take on the mantle. But you quickly realize how difficult it is to avoid public suspicion when you have no powers yourself."
WritingPrompts,[SP] Describe your favorite color to someone who is blind
WritingPrompts," The World Actually ended in 2012 but people continue about their daily lives, not knowing that Earth now exists in an alternate dimension"
WritingPrompts," A monumental event has occurred - mythological Gods have emerged, aliens have landed, a superhuman is filmed. Unfortunately, it's happened on April 1st."
WritingPrompts, a protagonist that knows he is the the main character of a story. Because of this he always turns the other way if he sees a dark cave or meets a strange person. Nonetheless the universe keeps throwing stuff at him to try to begin the story.
WritingPrompts," Your fairy godmother isn't a wise old woman or a cheerful little pixie. She's middle-aged, dressed in a business suit, and carries a briefcase and coffee cup"
WritingPrompts, Humanity has just met an alien spiece for the first time. They are curious but precautious. You are a part of the group responsible for teaching them about the earth and the multitude of cultures. They don't understand the concept of hoildays.
