subreddit,title
WritingPrompts," You know the saying ""if you cant see them they cant see you""? Well...you're blind and invisible. People think you're some ghost but you just think you're living a normal life."
WritingPrompts," Due to an unbelievable cosmic error, you've gained the power to make yourself and others completely *immersible*. Have fun, Submarining Man!"
WritingPrompts," You're in charge of the afterlife. Every religion gets it as they picture it. It's the first time you're visiting hell. When you ask them whether they really want torture and lava baths over beaches and piña coladas, things get a bit awkward. Suddenly one guy asks ""Wait, we can chose?"""
WritingPrompts," When you entered Valhalla, you never expected Odin, the Allfather himself, to be so angry at your welcoming feast..."
WritingPrompts," Our world, but no one ever grasped the concept of prerecorded media, so sporting events like football matches, movies and TV show re-runs have to be done live every time."
WritingPrompts," Several leaked documents reveal a dark secret about the planet. The entire earth is an egg, and it is going to hatch soon."
WritingPrompts,"You're a deity in charge of the weather. It's a boring job, but you get to play around with the ""butterfly"" effect. One day you screw up big time, in an attempt to cover it up you're introducing the concept of ""global warming"". The other deities are suspicious but the humans are loving the idea!"
WritingPrompts," The year is 2119, and the world has become severely overpopulated. You along with a few others have been tasked with killing off different people to keep the ever-rising population down. The catch? Secretly, you are the worlds clumsiest person."
WritingPrompts, The siege has dragged on for two weeks. Supplies are running low. The population are getting sick. More men fall at the walls every day.
WritingPrompts, Everyone has the ability to “Save/Reload” in real life.
WritingPrompts, Your spouse recently passed away. In their personal papers you find proof they were an identity thief--real identity unknown.
WritingPrompts," In the future, the sun is gone, and many doubt that it ever existed."
WritingPrompts," You go to a restaurant famous for its accurate fortune cookies to try one for yourself, but when you finally crack open your cookie, you see the paper is blank."
WritingPrompts, You are a priest that was called to exorcise the spirit of a young girl. Unable to do so you befriend her instead.
WritingPrompts," Your dog comes up to you and says: ""Noone will ever believe you"". Little did you know, that it was in fact, a curse...and it starts to take effect."
WritingPrompts," It's the year 3000, the world is ruled by the band Busted. Everyone lives underwater and your great great great granddaughter is doing fine. That is until a new band, the Jonas Brothers, arrives in their time machine."
WritingPrompts," Your entire life you have been able to see visions of your future with someone just by shaking hands. Usually its very underwhelmingly, most people forget about you rather quickly. Today, when shaking your new coworker's hand, you start weeping uncontrollably."
WritingPrompts, You signed up for a gladiatorial bout against a babe in arms. The opponent you got is not quite what you expected.
WritingPrompts," She found an old picture book covered in dust hidden in the attic while cleaning her and her boyfriend's house. When she opened it, she found dozens of old pictures of him and other girls. However, all the girls seemingly looked just like her. She ran to him and demanded an explanation."
WritingPrompts," ""This is why we can't have nice things."""
WritingPrompts," The earth is flat. It wasn't always, though."
WritingPrompts," Drinking coffee gives you energy, maybe too much energy. Now everyone seems to be moving really slowly."
WritingPrompts," The year is 3405, FTL space flight is achieved and common. You’re a billionaire who hires people to hunt for artefacts you made up for the sake of your own boredom. One day one of the groups comes back and excitedly hands you a box from some imaginary civilisation, exactly as you described."
WritingPrompts," You win a trip to Oak Island, and as a joke you bring a metal detector. You uncover a time capsule with a message dated in the year 2119 telling you where to dig."
WritingPrompts," You've been dating your girlfriend for some time now, but only today you realize why everyone 's been acting weird when you two are together: she is a ghost, and you're the only person that can see her."
WritingPrompts, A day in the world of an alternate universe which operates fundamentally on the principle of “tri-ality” rather than duality.
WritingPrompts," Vampires have been protecting humanity and werewolves against threats to them, while Werewolves have been doing the same for Humans and Vampires, while living under the age-old prejudices, and you have just found out this fact..."
WritingPrompts," You are an NPC in a game, accustom to a stable life. But today the devs triggered a seasonal/special event to spice things up"
WritingPrompts," You sit at the bar, sword on your belt and drink in you’re hand. The night was dark and stormy, the smell of mead filled the air. You spill a drink in the dwarf next to you, “what’s you problem elf!” He stands and raises a fist. A loud voice booms up “roll for initiative!”"
WritingPrompts," One day you are abducted by aliens. You spend days in a nicely furnished room until you hear someone shout ""human i choose you"" and you are ejected from yoir new home."
WritingPrompts," The PunPatrol has become a official federal authority, and quickly becomes the most powerful and corrupt law enforcement agency in the nation, throwing punners in work camps, and leaving puns only safe to make in the black market."
WritingPrompts," A pixie maiden infected with vampirism falls in love with a sprite lad infected with lycanthropy. Secretly meeting despite the blood feud between their clans, their angsty relationship faces a new challenge: Human villagers have settled near the forest and threaten the existence of both clans."
WritingPrompts," The year is 10,000 AD. The future of our dreams is finally here. Cyborgs, flying cars, teleportation, the works. Time travel has still evaded us, until one night your friend sends you back to the year 2000."
WritingPrompts," Ben Shapiro decides to take a Canadian vacation to the small PEI town, Letter Kenny."
WritingPrompts," After talking with and finally seducing a human, the alien is horrified when the human apparently begins to peel off their skin/exoskeleton..."
WritingPrompts, A small kid climbs a tree and looks out to his neighborhood. He shouts that he's king of the world. At that moment a crown falls onto his head and he actually becomes king of the world.
WritingPrompts," You buy a cheap haunted house, and adopt a dog, hoping he will warn you when he senses a ghost. You soon realize the dog thought you're the one who's able to sense ghosts."
WritingPrompts,[PM] Any half decent practice ideas.
WritingPrompts," You signed up for cryonics and were preserved immediately after your death. Ages later, you and others like you are brought back by alien colonists exploring the ruins of Earth, but the aliens haven't finished learning human languages."
WritingPrompts," Genghis Khan, Alexander the Great, Julius Caesar, and Napoleon Bonaparte play a game of Risk."
WritingPrompts," You can go forward or backward to any one day of your life at a time, but can only live each day once. This is the story of how history was swayed by you."
WritingPrompts, Lying gets you into trouble. You can even empathize with a certain long-nosed character from children's tales. Every time you lie a yellow flower the size of a half-dollar grows on random areas of your body. And every time you pluck your petals you feel much more than just shame.
WritingPrompts, Brains are alien parasites that attached themselves to humans centuries ago taking control over us and we can’t do anything about it because if we try to remove or harm them we die.
WritingPrompts," Lost in the mountains, dehydrated and malnourished, you found an egg the size of your torso with a pulsing heartbeat inside."
WritingPrompts, “Hello.” He awoke to a robotic voice echoing inside his head. Groggy and struggling to keep his eyes open he wipes away the crust in his eyes and takes a look around the room. “Please say Hello to activate voice command.”
WritingPrompts, One day while driving home you get stuck in traffic for the umpteenth time and in desperation you pray... But not to the typical big man upstairs. You pray to traffic god. Which surprisingly works as you have a clean drive home. But you didn't realize with his boon you must make an offering...
WritingPrompts," A story based on the quote ""Because ten billion years' time is so fragile, so ephemeral... it arouses such a bittersweet, almost heartbreaking fondness."""
WritingPrompts," Death has been flirting with you for a long time, but they've become rather annoying. After another attempt to hang out with you again, you jokingly tell them ""If I was the last person on Earth, I'd maybe give you a chance."" Death firmly believes on that, and will double their work."
WritingPrompts," On the night we switch to daylight saving time, 60 minutes of time disappear."
WritingPrompts," A community has just promoted a user into a mod, and this mod then bans a user for breaking an important rule. It was later discovered that the mods had developed workarounds after discovering the ""banhammer"" had a will of its own."
WritingPrompts," For your entire life you've been led by a future version of yourself, representing the best possible life, showing up at critical points, and wearing one of three sets of clothing. After a particularly stressful day, 3 future versions appear before you, each wearing one of the sets."
WritingPrompts, When you die you have the chance to fight for your right to live again. A man is about to die for the seventh time.
WritingPrompts," A genius serial killer who has been killing successfully for a decade. With one weakness. He can never ever lie. He's finally gets caught and is facing trial for a murder in court. Yet, he walks, acquitted of all charges."
WritingPrompts," A father comes home in the middle of his night with his new girlfriend, only to find his daughter sitting at the front porch with a shotgun"
WritingPrompts," Crows start evolving at an alarming rate. They develop languages, tools, and intellect more complex than is comprehensible to humans, using captured humans as their subordinates. They are on the brink of overcoming humankind as the dominant species of Earth"
WritingPrompts," I gasped as I woke and sand stuck to my face. I had done it but the island still had a small population and the forests would be tricky, not in comparison to cities though. Once the living dead were removed from this place I would have a home."
WritingPrompts," At the direction of a PR firm, the local police begin to hire new cops with an eye towards camera presence. You are an internet-famous Celebrity Cop, and you've just discovered that the serial killer you're chasing was hired by your producers."
WritingPrompts, All the sudden key moments of your life start playing out on every screen in the world like a movie. You have some dark secrets.
WritingPrompts, All the pictures have started moving around when you aren't looking.
WritingPrompts," During Creation, most animals have been designed by individuals, but you have been assigned to the Project Platypus committee - the first, and last, committee attempt to design an animal, the duck-billed platypus."
WritingPrompts," long ago the deserts on earth used to be filled with water. An archeologist just discovered that the creatures that used to live there didn’t disappear, but instead adapted to swim in the sand"
WritingPrompts, You receive a package in the mail with nothing written on it. You open it to find a silver coin with strange writing and pictures on it. By the coin is a paper that simply reads “Flip for luck. Head = Good. Tails = Bad.”
WritingPrompts, dragons and mystical creatures still exist but live on national reserves in order to protect them from human expansion and cities. You’re a park ranger on one of these reservations.
WritingPrompts," You have a ton of interviews to get through today. A few good potential candidates and several that might not get the call back. However, when you call for the next person, you're shocked. Not because they're a demon with noticeable horns fangs and a tail but because their resume is top notch."
WritingPrompts, The princess is a dragonborn. Everything is going fine except that it slowly become increasingly harder for her to resist her princess kidnapping instinct.
WritingPrompts," A thief robs a man at gunpoint and takes the man's backpack. While the thief starts rummaging through for valuables, the man runs away and shouts, ""It's your problem now!"""
WritingPrompts, You are getting very old. Your family think you suffer from dementia. You’re actually stuck between this world and another. The dementia phase is actually the time period where humans select their next life.
WritingPrompts, Humans adopt pets for comfort and happiness now that wouldn’t be so bad if it weren’t for the reason that a powerful alien race took a liking to us adopting us just as we adopt animals
WritingPrompts, You have been chosen to be the champion of one of the weakest gods in a battle royale in which the winner becomes a deity. All you’re given is a can of soda.
WritingPrompts," - They were massed atop the hill, silhouetted in a terrible sunrise. He felt old and tired. Perhaps this time the good guys didn't win."
WritingPrompts, you’re a lonely hs jock but the popular nerd keeps picking on you to read. one day you get fed up & decide to pick up a book
WritingPrompts," You've been living on a moon colony for most of your life at this point. You know the moon like the back of your hand, that's why you're surprised when you discover a strange sword lodged into a stone."
WritingPrompts," It Began long ago, on the battlefields of the great war. two german scientist sought to harness dark and mysterious forces, buried for centries. But they could never have imagined just what else there research would release."
WritingPrompts, You are part of a competitive school which involves training for a highly competitive exam. Recently people started committing suicides in innovative manners because of academic pressure. The school has decided to form a student committee to prevent them. You are sitting there for recruitments.
WritingPrompts," The year is 2219, and the universe has become so densely populated that God has run out of ""good"" souls to send down from heaven to inhabit the bodies of newborn humans. In his absence, Satan takes over."
WritingPrompts," You are having a basic outpatient operation. You tell the anesthesiologist you always have terrible reactions to anesthesia. So, he uses a new mixture to reduce the reaction. During the surgery, instead blacking out, you seem to cross over... and a voice says ""What the fuck are you doing here?"""
WritingPrompts," You have been ignoring the Duolingo messages for weeks, until a new one pops in your phone screen. Its the Duolingo Owl, he says: “That’s it, I’m coming for you!”"
WritingPrompts, You don't recall the last time you saw another human. All you have is the radio signal. It's been all that's kept you going as you've tracked it across the country. You've finally found the source.
WritingPrompts," You find a golden dagger while antique shopping. It fits your collection, so you purchase and take it home. To your dismay, it announces that you are now the chosen one. Again."
WritingPrompts,[SP] You shouldn’t have made fun of them.
WritingPrompts, You find an item in the 99 cent store that costs more than 99 cents
WritingPrompts,[SP] You are running away. Again.
WritingPrompts,"You are trapped in Hell, and the devil hands you a phone and says that you need to aquire 10,000 reddit gold to be able to go to heaven"
WritingPrompts," ""I am a man of magic. I don't believe in science."""
WritingPrompts," You are a serial killer, and you finally decide to retire after your last kill. However, you suddenly start seeing the spirits of those you’ve murdered, and they are not happy."
WritingPrompts," Five years ago, a cure for almost every illness is discovered. Presently, you're a doctor who's struggling to pay your bills. One night, you receive an anonymous message saying..."
WritingPrompts,[IP] George Washington: zombiehunter
WritingPrompts," You have two special powers. One is the ability see supernatural beings such as gods, deities, and spirits. The other ability is much more powerful. It’s the ability to reverse anything in the world. Essentially, the strongest “no u” on Earth."
WritingPrompts," The first human space mission to Mars returns to Earth after 6 years. It is quickly discovered that all 5 crew have not aged since leaving Earth's orbit. This leads to the discovery that aging, and perhaps death, is not an inevitable fate, but rather a phenomenon caused by the Earth itself"
WritingPrompts,"[TT] The hardest thing to do in life, is closing doors."
WritingPrompts,[OT] SatChat: What are your go-to writing snacks?
WritingPrompts," In the distant future, a human race who have long since forgotten war now struggle against enemies from beyond the milky way. As the great fleets that their ancestors built fall to the onslaught of enemies, one captain discovers a console command that reads ""FLEET WIDE COMBAT MODE""."
WritingPrompts,The bars had just closed and I was pretty wasted and I went into this takeout place for a slice. As I was waiting in line I looked out the window and there was a guy and a woman arguing and fighting over a bread bag filled with glue that they had been huffing and the bag had puke in it.
WritingPrompts, A conspiracy theorist who believes the government is trying to kill everyone with mass produced food and fluoridized tap water tries to kill his parents in order to gain his inheritance. He removed their water filter and bought them deli ham. He’s starting to get frustrated.
WritingPrompts, A law has just been passed that legalizes cannibalism. They say it’s to solve world hunger and overpopulation.
WritingPrompts," You found a piece of psychic paper. It's really useful, but it took an embarrassingly long time to figure out what it was."
WritingPrompts," A plane crashes in desolate northern Russia. There are 31 survivors. Every night one disappears and even though no one sleeps, they’ve never seen it happen. One day everyone is gone in the morning but you."
WritingPrompts," You save a little girl that had been stranded on an isolated island for years, and decide to adopt her. At the start she can't speak because she doesn't know how to, but soon enough you find out she's the most intelligent child you've ever seen."
WritingPrompts," A soon-to-be executed inmate asks for a bottle of vodka for his last meal. Little did they know, they are a drunken master of fighting."
WritingPrompts," An alien space ship crashes on Jurassic Earth. The crew now has to use all of their expertise to try and leave, but maybe Earth isn't as bad as they thought"
WritingPrompts, A legendary fictional gunslinger from the Wild West just showed up in the real world. He challenges a vicious gang to a duel at high noon.
WritingPrompts," You, an ancient evil of a fantasy world that awoke without any of your powers centuries later. Trapped for years unable to escape, all this changes when a young orphan finds you and offers to free you in exchange for becoming their friend. So began your adventures together."
WritingPrompts," Eons agos, the universe was overflowing with Shub-Niggurath's young. To curb this overpopulation, a new outer god was born, a shepherd of the baby goats. He is now your dog. One day, An Outer god comes knocking, and they want their shepherd back. Now you have to stop them from taking him away."
WritingPrompts," On a dark and stormy night, sky flashing silver and thunder booming, you're out taking a walk in the heavy rain to admire the beautiful ambience. Suddenly, you look up to see that some of the flashes are caused by two men fighting so fast, they are causing sonic booms."
WritingPrompts, You discover one day that your kisses actually DO have healing powers.
WritingPrompts,"[EU] you are on a road trip and after getting lost in a storm you take shelter in a 1950s looking diner. A diner that serves some unique cliente a menu that includes scrambled Alien eggs, Critter burgers and Blob jello."
WritingPrompts,"[EU] You are the Green Lantern of an Earth with no other superhumans. You hold the most powerful weapon in the universe. Instead of frittering away your time fighting supervillains, you set out to actually change the world."
WritingPrompts," You prepared for it, they laughed at your face, normies called you a psycho and other preppers a dumb bitch whom misspelled even ""Apocalypse"". Now you're the one who laughs, the Alpaca Lips is here. This is God, this is mankind, and this is Jackass. Today we're going to kiss Alpacas or burn."
WritingPrompts, Next on the Discovery Channel: The dragon that was found in a birds nest.
WritingPrompts,"You've recently died, however you don't fear Hell since you have a get out if Hell free card: Just show it to the Gatekeeper of Hell and you're immortal soul is free to go. Now as you present your card to the Gatekeeper a wicked smile formed on his face. ""You didn't read the fine print did you?"""
WritingPrompts," You've been locked in what looks like an alchemist's lab. You've been given a book which translates your language into a different, indescribable one. A note in that language has just been slipped under the door."
WritingPrompts, Scientist were able to prove that every human has a fixed amount of luck. Being incredibly lucky in one thing means not being lucky on others. You just won the lottery for the third time in a row.
WritingPrompts, You finally earned your spirit animal. Unfortunately it's a stubborn tabby that wont acknowledge your existence.
WritingPrompts," Your identical twin brother was born a still-born. Your twin bond allowed you to see him grow up with you. Many years pass and you’re in high school, as usual you’re sitting alone at lunch, That’s when she showed up and sarcastically said “Are you guys identical twins?, You both look so alike”."
WritingPrompts, You watch as a city falls. Why? Because you did the all nighter.
WritingPrompts," Gordon Ramsey has heard people thanking this 'God' person for meals that he cooked, and he's tired of it. Gordon decides to go up to the big man upstairs and show him what he's worth. This is Heaven's Kitchen."
WritingPrompts,"The two greatest super heroes in the world got married a fee years ago. And now they embark on their greatest challenge yet: Parenthood. That might not be a huge problem for them, except that their child is showing signs of super powers way sooner than they thought."
WritingPrompts," An alien civilization with an interstellar colonial empire reaches Earth. They state, ""We have one demand. Let us sterilize the continent you call Australia and colonize it. Refuse and face annihilation."" Humanity considers war. The bad news? Your family is on vacation in Sydney."
WritingPrompts," You've been the best person you can throughout your life.. Abiding by the ""Rules of the Game"". You were walking home and got mugged! ""Rules"" no longer apply!!!"
WritingPrompts," For your 10th birthday your parents bought you a Nintendo Power Glove which, from your experience, was a major let down. 30yrs later your parents call telling you they are throwing it away. Coincidentally, Nintendo releases a statement finally admitting that only 1 glove was actually ever sold."
WritingPrompts, You wake up in a cold sweat. The dream about ‘the floor is lava’ you had felt entirely too real. A mysterious man sits in front of your bed and tells you that you’re in hell but will only be tortured in your dreams. Last night was the first of your eternal sentence.
WritingPrompts, You are reborn as a person with a personality based on the posts of every subreddit you are subscribed to.
WritingPrompts," ""I'm sort of a chicken magnet..."" he said, ""Don't you mean chick magnet?"" the stranger replied. In the distance, the sound of a million little feet thundered across the land, accompanied by frantic bawking, ""We have to go. Now.""."
WritingPrompts," Dr. SuperBatTyrellBog is looking for new surnames and surname extensions. Only, they would be, if the world wasn't so obsessed with equility to the point of not making it through the ice age and that that guy hadn't actually existed.."
WritingPrompts,"You're sitting down for a polygraph test, massive stakes, and you are going to lie. But you had a heart transplant years ago - your heartrate never changes."
WritingPrompts," Earth has been challenges to elect a fighter to represent earth in combat, the opposers weren’t expecting us to elect the infamous “Florida Man”"
WritingPrompts, One day you wake up and suddenly know how the world is going to end in 90 days. So you start your journey to kill every ladybug on the planet.
WritingPrompts," One day you wake up with a very powerful power, you can control what countries get which movies on netflix."
WritingPrompts," You are a serial killer, but the hitchhiker you picked up is too. You’ve been trying to subtly kill each other for over a week on your infuriating road trip."
