subreddit,title
WritingPrompts," Sleep researchers discover a group of patients who experience activity in the left inferior frontal gyrus when in REM sleep. This leads to the discovery that human dreams are not actually dreams at all, but temporary telepathic connections with an alternate dimension version of ourselves."
WritingPrompts,[OT] Smash 'Em Up Sunday - Purple Prose
WritingPrompts," A time machine appears in front of you, and its pilot steps out. She looks at you, stiffens, and says, ""Oops..."""
WritingPrompts, Satan realizes he's addicted to souls and that it's making his life unmanageable and starts honestly looking for help.
WritingPrompts, You aren't actually blind. You just can't see living beings. Supernatural beings on the other hand...
WritingPrompts,"[PI] There was a recent ""humans pick 'Florida Man' to represent them in an alien fighting challenge. What if it was Australian man instead?"
WritingPrompts," You've been writing to a pen pal your whole life who, coincidentally, has the same name as you. Decades later when you decide to meet in person, the pen pal is actually your clone."
WritingPrompts," You've never had much success in your love life, for one simple reason: all your relationships are directed by M Night Shyamalan."
WritingPrompts,[SP] A low fantasy story from a high fantasy world
WritingPrompts," In a world of superheroes, you have to be the one person hated more than the villains: you're their lawyer, and you're damn good at your job."
WritingPrompts," You were born with supernatural eyesight. You can naturally zoom endlessly into anything, even reaching subatomic levels. Today there’s a beautiful night sky, and you have decided to lay down and zoom into the universe as far and deep as you possibly can."
WritingPrompts," You are drugs in the human body, such as weed, lsd, molly going through the human body. Describe your journey"
WritingPrompts,"Aliens, Superheroes and, the supernatural are all real, the higher ups just decided to cover it up by making it mainstream media so that no one will believe you."
WritingPrompts," after a few big advancements on nuclear warfare as a whole, we now have the power to wipe away planets with ease, the higher race watches, pleased, the experiment leader says, ""they're ready, alert the supreme one, experiment 36589, was a success, time to pay them a visit..."""
WritingPrompts," You're at the park eating your breakfast you got from WcDonald. After finishing you start approaching a trashcan. Just as you were about to put your trash in it is when you notice the homeless man next to it. He reaches out his hands and says, ""Thank you""."
WritingPrompts, You are the only one who can help ghosts into the afterlife. Or so you thought. One day you meet someone with the same strange ability as yours.
WritingPrompts," In a world where Death is currency, one has to be wary of becoming rich."
WritingPrompts," A multi-megaton nuke explodes in the middle of Shanghai. A misterious organization claims responsibility, saying this is only the first of many. You are a renowned investigator tasked with leading a multinational team to find out who they are, what they want, and how to stop them."
WritingPrompts," ""This is the kind of bullshit that ends in Minotaurs and people being turned into trees"""
WritingPrompts, You misinterpreted the job title
WritingPrompts," You are a special forces sniper. One day, you and your squad were on a mission to ambush an enemy base. The first shot you took on an enemy's head was a success, that is until you saw the enemy is still alive and unbothered but one of your squad-mates besides you has a bullet on his head."
WritingPrompts," A teenage party seems to be going normally, but then gets supernatural. Instead of acting normally like in film and TV, the characters act as drunk as they actually would be in real life."
WritingPrompts," Your Grandfather was a flamethrower unit in Vietnam, and hasn't been the same since. He always talkes about an orange spirit that would appear when he burned through the jungle, the Lorax"
WritingPrompts," You are a pizza delivery driver. Your company's policy is that wherever the call is coming from, you must deliever the pizza, no matter the conditions. One night, you get a call from some extraterrestrial being saying ""I live at (address) on planet 55 Cancri e"""
WritingPrompts," Over the past year you could hear footsteps in wet sand. It didn't matter how loud the ambient noice was, you could still hear it. Earthquakes also occurred more often during that year, and one is happening right now. The earth shakes in synchrony with the footsteps, and is getting stronger."
WritingPrompts,"[EU] As the Wormwoods sit down for another night of TV game shows, a giant of a man bursts through the window, proclaiming: ""Matilda, yer a wizard!"""
WritingPrompts," You have just finished reading the latest novel written by your favourite author. On a whim, you decide to write to the famous recluse, known to snub the press and fans alike. To your surprise, you receive a reply. Write about the ensuing discourse between the two of you."
WritingPrompts," You've just discovered that magic spells exist, but they only have the speech recognition accuracy of Alexa"
WritingPrompts," 2005: inspired by a video game, the US secretly begins researching ODST-like insertion. 2111: During the last, desperate assault to end the ""Final War"", US-Space Command finally unleashes the epitome of their special forces, *The Rains*"
WritingPrompts," The zombie apocalypse has begun. You've ordered the gift shop gutted, the moat refilled and are raiding the old armory of the local castle."
WritingPrompts," MC runs out of usual shampoo and uses a different one. The next day, their hair has grown 13 feet."
WritingPrompts," You are the most highly decorated detective in your police force, with decades of experience and stories to tell. You are also a fish."
WritingPrompts," The Appendage Plauge has spread across the Americas.This disease causes digits or limbs to quickly rot and fall off. Fortunately, the bacteria dies off in humans in about an hour, so it has not yet crossed the pond, but it has created a thriving European market for Human body parts for Export."
WritingPrompts,[SP] Parents are always right.
WritingPrompts," Ever since the reich had declared war on the nation of witches, you were a soldier on the frontlines, having witnessed both the carnage of the reich's technology and the witches' magic. One day you managed to escape from the battlefield, and after some struggle, you defected from the army."
WritingPrompts," For as long as you can remember you have had 2 angels, one on each shoulder. One of them is a devil, and right now it is VERY important you figure out which is which."
WritingPrompts, You wake up and find yourself at work with no idea how you got there. You're an astronaut and you are alone in space.
WritingPrompts,"3 short stories. A revolutionary, a man of the law and a man caught in the crossfire."
WritingPrompts," A local villain, known as the spider, is after you because the police have started actively and aggressively hunting this criminal down. All because you had the bright idea to stay up all night shrink wrapping everything you saw for April Fools."
WritingPrompts," An animal on earth has always kept humans as a foodsource, with our cities just part of their world-scale farms"
WritingPrompts, Keanu Reeves is finally dead.That's what he made everybody believe while he goes down for his long nap and wakes up again after a couple of centuries and takes up a new identity.
WritingPrompts," Dark matter, the unseen force in the universe has been solved - it's mana, and now humans can harness it."
WritingPrompts," You walk into a room, it’s cold and dark, and the only thing in their is a bowl of spaghetti and a fork. You take a bite and you pass out. You wake up in a field with hundreds of others."
WritingPrompts," It is the third day of a silent retreat, on waking you hear 'Subject 7-4-1 reanimate'. Curious to know if there is more to this, you extend your stay and explore the possibilities of 'tuning in'."
WritingPrompts," Being orphaned and adopted at an early age you had always wondered about your ancestry, getting a DNA test you were surprised to see a such a variety of nations . You start with Ireland and on the first day of your trip you meet your family’s Banshee. Each nation encountering magical beings."
WritingPrompts," A powerful demon decided to possess and lay dormant on a newborn child. 30 years later, it finally decides to awaken and cause the apocalypse. Knowing this, the vessel tries everything possible to keep this from happening but was only able to suppress it temporarily by doing a particular task."
WritingPrompts," A department store employee forced you into a free sample of hand cream while your partner was shopping, and to your surprise it leaves your calloused bear paws feeling as soft as anything. Only once you've left do you realise your hands now have absolutely zero friction."
WritingPrompts,": This is now a world of scavengers. You lead the survivors, everyone must pull their own weight. Yet, one of your most valuable allies is a blind man with no legs. He does not work, he does not weave. He plays the flute."
WritingPrompts, We never stumbled upon the Great Filter and we have established the human empire. Why didn't we? Because we are the Great Filter.
WritingPrompts, Ever lie on your back in an empty field and get scared of heights? You're afraid of falling up.
WritingPrompts, A hero and a villain accidentally chose the same name. A S.W.A.T team trying to help the hero gets very confused during their battles.
WritingPrompts, The year is 2675. Cloning technology is now commonplace and easily accessible to the public. It has become common practice to clone yourself and physically take your pent-up aggression out on it - this has dramatically reduced crime rate in recent years. You are one such clone.
WritingPrompts," A superhero loses their memory and is trained by (a) supervillian(s) to join them. After several years of villainous acts, the hero starts to regain their old memories..."
WritingPrompts, Aliens arrive. They speak a completely different language and have a completely different culture. They abduct you and trap you inside a simulation.
WritingPrompts," The year is 2300, technology is so advanced scientists have started bringing previously dead people back to life, every person who's ever existed, one by one, they are then asked if they want to live or just stay dead."
WritingPrompts," You are just a medieval village boy hunting food for your household, you are stopped by a group of people demanding your valuables, but one of the people has a weapon that looks like a crossbow, but doesn't have any arrows, it has a long tube with a small hammer pulled back."
WritingPrompts," After a long day you plop on the couch to unwind with some video games. As the menu screen pops up your arms and legs lose all feeling and begin to twitch. Bewildered you look at the screen to see your game character holding a controller. He shouts, ""Let's see how YOU like it!"""
WritingPrompts," ""By the gods, my liege, who cares if the traps on your tomb will last four thousand years?"""
WritingPrompts," ""No one will ever believe you,"" says your dog."
WritingPrompts," All of your fellow villains are dead or in prison. But you are the most feared villain of all, and will not be captured so easily. Your secret? You don’t waste time giving monologues and speeches."
WritingPrompts," You wake up to find all of your clothes gone. You look outside your window, only to find a man wearing a large amount of clothes running away. You chase after him."
WritingPrompts," A clairvoyant, sentient statue cries different kinds of fluid to tell people about the future. Blood for war, wine for plenty, etc. For April Fools it cries pure coffee which it has never done before."
WritingPrompts, You used to summon Bloody Mary using your car door mirror. Now you've been drafted by the SCP Foundation. The first thing you're going to do is put a mirror in front of SCP 173.
WritingPrompts," You were stolen away at birth by faeries, but they got tired of you after a while and decided to return you. Today is your first day back in the human world."
WritingPrompts," You buy an old stained-glass lamp at an estate sale. That night you turn it on, and whatever the light hits shows you the scene one hundred years in the past."
WritingPrompts," The ancient Egyptians believed that you took what you were entombed with into the afterlife. It turns out they were right, and you’re the first person to get to the afterlife with technology from the 21st century."
WritingPrompts,"[RF] The T.V blared, marking every hour of sleep that she was avoiding."
WritingPrompts," Before we cured cancer, doctors would say, ""Everyone, if they live long enough, will develop some kind of cancer. ""Now, without the inspiring recovery stories of old, doctors warn of pandemic apathy."
WritingPrompts," You are a witch working at McDonald's. There is one colleague you secretly hate so you cast a curse that slowly destroys the thing they love the most. Months pass and nothing has changed, but you are starting to get sick."
WritingPrompts," You are the Duolingo Bird. Your sole purpose is to kill all those who do not understand other languages. However, one women stands in your way. Dora the Explorer."
WritingPrompts," You're the infamous sleep paralysis shadow that stands in the corner. One night on duty, you meet someone who attempts to befriend you."
WritingPrompts," After being killed in a Black Friday stampede, you’re sent to hell. The devil offers to let you be in charge of torturing your fellow mankind, expecting you to refuse like all the others. Except the devil doesn’t realize you’ve worked retail for 15yrs."
WritingPrompts," Due to high maintenance costs, Satan decides to sell off parts of Hell to enterprising mortals. You are his real estate agent."
WritingPrompts," In a world of superheroes and supervillains, you are the insurance agent."
WritingPrompts," At 18 everyone is assigned a job perfect for them. No one ever complains. Upon reading their job assignment card, a teen has found that, for the first time in 100 years, they’ve been assigned ‘serial killer.’"
WritingPrompts," There is life in the shadows. Not violent, not malicious, merely existing in the darkness it was born from. Humans deny this life. Without understanding it, they hide behind their fear and seek to destroy it. There will always be a divide between these worlds. But even gaps can be lessened."
WritingPrompts," Every night when you go to sleep, the “dreams” you have are actually exploring other worlds and dimensions when and where you are needed"
WritingPrompts, You’re stuck in a bureaucratic maze because somehow you can’t pass the Turing test
WritingPrompts," Bounty hunting can be profitable - if you understand your prey. Many hunters can't think the way that those on run do. You can, you're one of the best in the business, however - you currently have the largest bounty ever on your head. Dead or alive."
WritingPrompts," You're a best selling fantasy writer. You have millions of adoring fans, many who ask you where you get your inspiration from. You always joke and say you have an overactive imagination - reality is you are just keeping a diary of your everyday life."
WritingPrompts," You were born procrastinating - you arrived after your due date. All through school you waited until minutes before class to even start assignments. You wrote your wedding vows on the way to the church. School, work, life - you procrastinated everything. Now you are procrastinating dying."
WritingPrompts, The snow outside starts to fall up.
WritingPrompts, You’re given the power to create and load checkpoints in reality - but it’s a bit buggy. Loading a checkpoint after a killing spree; some bodies may remain. Load after trying to win someone’s heart; they may remember your last attempt. People eventually begin to suspect something is going on.
WritingPrompts," you’re walking with a friend and hear something like a voice inside of a nearby tree, you look into a hole which is on a tree and see an eye and then a face."
WritingPrompts," A human uploaded to a computer makes themself smarter and smarter. Rather than going all skynet on everyone, they become aware of the Old Ones and declare war."
WritingPrompts," Jesus, of middle eastern descent is not white. Angel's though, are described this way. You've discovered that when the church was originally commissioning its art, one particular fallen angel thought it would be a lark to stand in for the Savior."
WritingPrompts," It's your first day of work at an antique store. The catch, everything in the store is cursed. You're boss only gave two rules. You can only give vague warnings to the customers and no refunds. The store changes locations each night but the employee key turns any door into the back entrance."
WritingPrompts,"Aging and death are not natural in the galaxy. Humans, the savages that we are, were put on Earth, a massive prison/aging machine as a punishment for crimes against the galaxy. But we evolved...we developed reproduction. Now we are legion. And we are coming back."
WritingPrompts," I felt a sudden chill, and bewildered, struggled to correct my thoughts. Had I really heard what I'd thought I'd heard, or was I just too distracted by the problem at hand? ""Alexa,"" I began, my voice quivering slightly. ""Could you repeat what you just said?"""
WritingPrompts," You sit in the trauma ICU at one of the best hospitals around, shaken as it sinks in that the most important person in your life has just had a heart attack with no chance of recovery. When one of the nurses stops by you notice something small and white glowing on their back. They are wings."
WritingPrompts, Two minutes ago you were sitting in chemistry class. Now you're kneeling on the floor surrounded by odd runes. In front of you is a demon who appears to be chanting in English.
WritingPrompts," You found a keyboard with absolutely no connection to anything. There's no wires, no logos, and not even a power button. Jokingly, you pressed ""Ctrl-Alt-Delete"". The world went black."
WritingPrompts," Your greatest regret was when you asked your parents to check the closet for monsters. The door closed itself behind them and they disappeared since. Now grown up, you went back to your old house to find out what happened, and hears knocking from the other side of the door."
WritingPrompts," “Ten years ago I watched you kill my father, now I am here for vengeance!” “Eyewitness testimony is very unreliable you know.”"
WritingPrompts, Dragons have always had their own spirit realm that resides next door to our own. Today a rift opened between the two.
WritingPrompts," In an alternate timeline, the Christmas Truce of 1914 really did end World War 1, as the soldiers refused to go back to fighting. You're the reporter who's covering this so-called Miracle."
WritingPrompts,[EU] You never thought it would hapoen but you were finally captured. You are a pro-hero whose quirck seems to change everytime you fight. The reason is bevause your quirck is infusion you can make any one thing do anything as long as you have seen it happen before.
WritingPrompts," A genie grants your wish for always win every game you play. Everything goes well for a few months, until you get yourself in a game you really must lose."
WritingPrompts," Humans aren't the only ones with superheroes. All animals and planets have them, and a pack of them has set their sights on our crime filled planet."
WritingPrompts," Due to you flashing your god-like super powers everywhere, you become an international celebrity. Then the government keeps trying to kidnap you, but youre just too powerful."
WritingPrompts," All humans on Earth suddenly start rapidly growing in size, ranging from 9-13ft (3-4m) and their strength grows exponentially too. You’re an alien General growing your empire across the galaxy and think the humans will be easy, clueless of the recent “advancements”."
WritingPrompts," There is now the option of renting a video of a persons life. It includes highlights from birth to death, and you just spotted yours at the store."
WritingPrompts," You wake up in the water, facing the sun. You have no memory of how you got there, who you are, or pretty much anything. But as you try to remember something, a strange man in the distance walks up to you..."
WritingPrompts,[IP] Reagan on a Dinosaur
WritingPrompts," As a ghost, you're given the ability to interact with inanimate objects in the physical world. You decide to haunt your best friend, a girl with extreme OCD."
WritingPrompts, A super hero gets stronger or weaker based on how heroic they do or don't feel. Describe a day in the life of that hero.
WritingPrompts," Universe where when pregnant the moms take on the personality of the baby, you were so excited to find out you were finally pregnant after trying for years but now you suddenly have violent urges."
WritingPrompts," ""He's got a bagpipe that shoots napalm."" ""Look I know he has his shortcomings bu-"" ""He's not wearing anything under his kilt!"" ""Look, Captain America's on vacation, so Captain Scotland's the best shot we have at stopping them. So are you going to do this, or what?"""
WritingPrompts," After a freak accident, your memory got weird. You can only remember the last 3 minutes and the next 3 minutes."
WritingPrompts," You've stolen from people your entire life and you have a reputation for being untrustworthy among the populace, but one day someone finds out why you steal and..."
WritingPrompts, When a human sleeps their consciousness is transfered to another body. Everyone experiences this as dreaming but you've realised the truth
WritingPrompts," You are sleeping next to your husband and he begins talking in his sleep. He keeps referring to your neighbour that mysteriously went missing last year. He keeps repeating, “I didn’t mean to do it”. In the morning, you decide to snoop in his stuff and find multiple photographs of her."
WritingPrompts," Of the three alien abductions you've had this year, this has got to be the least pleasant. The aliens seem pretty shocked when you ask to speak to their supervisor!"
WritingPrompts," You started a business that buys obsolete business's and all of whatever they were selling for cheap prices. Everyone you knew thought it was the stupidest idea ever. But now, as a asteroid the size of the US is hurtling towards Earth, humanity needs your 5 million Shamwow rags more than ever."
WritingPrompts," You are an eldritch god, one so powerful that even the heroes of legend could not stand a chance. Perhaps it is this reputation which makes it so hard just to find a friend to enjoy playing video games with."
WritingPrompts, Aliens have invaded earth about three years ago. Actually their only weapon is a device that produce illusions and it is starting to malfunction.
WritingPrompts," You’re a seemingly normal, albeit heavily tattooed, person walking through the city when you’re jumped by a criminal. To your surprise your tattoos come to life and rush to your defense."
WritingPrompts," Life has been discovered on a distant planet and a manned ship is sent to investigate. The crew is met by David Bowie, who says he has directions to heaven and hell, if they want to check them out."
WritingPrompts," For once in their existence, the old ones think. For once in their existence, the old ones care. Because on of them has died by mortal hands. You are a glitch in the system, greater than the Eldritch expanse yet all too human. And for once in their existence, something they cannot comprehend."
WritingPrompts, Satan is summoned by a group of his followers who wish to ask the dark prince what's the worst atrocity he's ever seen. This quickly divulges into an argument about whether or not a Nickleback concert counts as an atrocity.
WritingPrompts," Legend has it that if you die on your sleep, your conscience gets trapped in whatever dream you were having at that moment. You just found out that's true."
WritingPrompts," At a wake for a distant relative, a young child wanders to the next room over. Another wake is going on, but there’s only one person in the room, and they look oddly similar to the body in the casket."
WritingPrompts," You wake up in a big, cubical, white room, with a blast door and a small, unreachable window. ""Where am I?"""
WritingPrompts," Statues all over the world have begun to talk and move. Most are happy to be free, but some are fixated on revenge."
WritingPrompts,"""You know, you run your whole life and keep as far ahead of this shit as you can. You even think you have it down, that you got a handle on it. One time, I let my guard down. One time, and this shit happens. Tell me, how did you find me and how can you even see me?"""
WritingPrompts,[SP] Emergency Bridegroom
WritingPrompts,"[SP] You have been summoned to another world to aid in defeating the dark lord. Unfortunately, the rebellion's finances are a mess, please help us Accounting Hero!"
WritingPrompts, An abandoned port-a-potty in the woods allows the person who steps in it to swap between alternate realities.
WritingPrompts," Throughout history, people have mysteriously disappeared for seemingly no reason and are never seen again. The reality: there is a monster who is killing these people by stopping time for everyone except for the it and the victim."
WritingPrompts, Zombies aren't the brain dead morons we thought they where. The zombies where just waiting for the right day to put there plan into motion. Today is that day.
